{
  "schema_version": 1,
  "id": "cube",
  "title": "立方体 · 解析基准",
  "crystal_system": "等轴",
  "point_group": "m-3m",
  "index_count": 3,
  "basis": [
    [
      0,
      1,
      0
    ],
    [
      0,
      0,
      1
    ],
    [
      1,
      0,
      0
    ]
  ],
  "expected_faces": 6,
  "forms": [
    {
      "hkl": [
        1,
        0,
        0
      ],
      "distance": 1
    }
  ],
  "metadata": {
    "axis_choice": "三条相互垂直的四次轴为a、b、c；c直立。",
    "basis_note": "理想单位轴比与单位面距。"
  }
}