{
  "schema_version": 1,
  "id": "439",
  "title": "电气石 · 九柱面与异形两端",
  "crystal_system": "三方",
  "point_group": "3m",
  "index_count": 4,
  "basis": [
    [
      -0.5,
      1.0,
      0.0
    ],
    [
      0.0,
      0.0,
      2.0
    ],
    [
      0.8660254037844386,
      0.0,
      0.0
    ]
  ],
  "expected_faces": 16,
  "faces": [
    {
      "id": "F01",
      "hkl": [
        1,
        -1,
        0,
        2
      ],
      "distance": 1.82,
      "expand": false,
      "label": "原图 1 · 正端三方单锥面",
      "evidence": "照片编号与相邻关系；遮挡面按候选对称关系补全",
      "photo_label": "1"
    },
    {
      "id": "F02",
      "hkl": [
        -1,
        0,
        1,
        2
      ],
      "distance": 1.82,
      "expand": false,
      "label": "原图 2 · 正端三方单锥面",
      "evidence": "尖端照2与侧面照片的环向对应尚有歧义；本页按侧面及负端相邻关系暂配，需实物翻转核对",
      "photo_label": "2"
    },
    {
      "id": "F03",
      "hkl": [
        0,
        1,
        -1,
        2
      ],
      "distance": 1.82,
      "expand": false,
      "label": "原图 3 · 正端三方单锥面",
      "evidence": "尖端照2与侧面照片的环向对应尚有歧义；本页按侧面及负端相邻关系暂配，需实物翻转核对",
      "photo_label": "3"
    },
    {
      "id": "F04",
      "hkl": [
        1,
        -1,
        0,
        -2
      ],
      "distance": 1.7200000000000002,
      "expand": false,
      "label": "原图 4 · 负端三方单锥面",
      "evidence": "照片编号与相邻关系；遮挡面按候选对称关系补全",
      "photo_label": "4"
    },
    {
      "id": "F05",
      "hkl": [
        -1,
        0,
        1,
        -2
      ],
      "distance": 1.72,
      "expand": false,
      "label": "原图 5 · 负端三方单锥面",
      "evidence": "照片编号与相邻关系；遮挡面按候选对称关系补全",
      "photo_label": "5"
    },
    {
      "id": "F06",
      "hkl": [
        0,
        1,
        -1,
        -2
      ],
      "distance": 1.7200000000000002,
      "expand": false,
      "label": "原图 6 · 负端三方单锥面",
      "evidence": "照片编号与相邻关系；遮挡面按候选对称关系补全",
      "photo_label": "6"
    },
    {
      "id": "F07",
      "hkl": [
        0,
        0,
        0,
        -1
      ],
      "distance": 1.85,
      "expand": false,
      "label": "原图 7 · 负端底面",
      "evidence": "照片编号与相邻关系；遮挡面按候选对称关系补全",
      "photo_label": "7"
    },
    {
      "id": "F08",
      "hkl": [
        1,
        0,
        -1,
        0
      ],
      "distance": 0.78,
      "expand": false,
      "label": "原图 8 · 宽柱面",
      "evidence": "照片编号与相邻关系；遮挡面按候选对称关系补全",
      "photo_label": "8"
    },
    {
      "id": "F09",
      "hkl": [
        3,
        -2,
        -1,
        0
      ],
      "distance": 1.02,
      "expand": false,
      "label": "原图 9 · 窄柱面",
      "evidence": "照片编号与相邻关系；遮挡面按候选对称关系补全",
      "photo_label": "9"
    },
    {
      "id": "F10",
      "hkl": [
        1,
        2,
        -3,
        0
      ],
      "distance": 1.02,
      "expand": false,
      "label": "原图 10 · 窄柱面",
      "evidence": "照片编号与相邻关系；遮挡面按候选对称关系补全",
      "photo_label": "10"
    },
    {
      "id": "F11",
      "hkl": [
        2,
        -3,
        1,
        0
      ],
      "distance": 1.02,
      "expand": false,
      "label": "原图 11 · 窄柱面",
      "evidence": "照片编号与相邻关系；遮挡面按候选对称关系补全",
      "photo_label": "11"
    },
    {
      "id": "F12",
      "hkl": [
        0,
        -1,
        1,
        0
      ],
      "distance": 0.78,
      "expand": false,
      "label": "原图 12 · 宽柱面",
      "evidence": "照片编号与相邻关系；遮挡面按候选对称关系补全",
      "photo_label": "12"
    },
    {
      "id": "F13",
      "hkl": [
        -2,
        -1,
        3,
        0
      ],
      "distance": 1.02,
      "expand": false,
      "label": "原图 13 · 窄柱面",
      "evidence": "照片编号与相邻关系；遮挡面按候选对称关系补全",
      "photo_label": "13"
    },
    {
      "id": "F14",
      "hkl": [
        -3,
        1,
        2,
        0
      ],
      "distance": 1.02,
      "expand": false,
      "label": "原图 14 · 窄柱面",
      "evidence": "照片编号与相邻关系；遮挡面按候选对称关系补全",
      "photo_label": "14"
    },
    {
      "id": "F15",
      "hkl": [
        -1,
        3,
        -2,
        0
      ],
      "distance": 1.02,
      "expand": false,
      "label": "原图 15 · 窄柱面",
      "evidence": "照片中编号未清楚读出；按剩余窄面及三重关系暂配",
      "photo_label": "15"
    },
    {
      "id": "F16",
      "hkl": [
        -1,
        1,
        0,
        0
      ],
      "distance": 0.78,
      "expand": false,
      "label": "原图 16 · 宽柱面",
      "evidence": "宽面位置由三重关系与相邻窄面推定；编号暂配",
      "photo_label": "16"
    }
  ],
  "metadata": {
    "symmetry": "L³ 3P",
    "axis_choice": "以唯一 L³ 为 c，+c 指向1、2、3相交的尖端；基面内沿三个等价方向取 a₁、a₂、a₃。",
    "basis_note": "参考 a:c=1:2，用于候选面型的可计算展示，不是实测晶胞轴比；面距按照片外形近似设定。四指数 (h k i l) 必须 h+k+i=0。 图中轴箭头仅表示方向与正负，长度不表示晶胞轴长。",
    "mineral_name": "电气石",
    "description": "9 个柱面 + 正端3个锥面 + 负端3个锥面及1个底面。",
    "notes": [
      "用户确认晶系与总面数；F01 对应照片红色1，依此类推。",
      "按照平面、共棱与候选对称关系构形；编号证据见逐面表。",
      "照片和模型并列核对；只有已配准照片提供线框。",
      "439 的尖端2/3环向对应尚需翻转核对；照片2保留原图，不提供可能误导的编号线框。",
      "矿物名由用户给定。黑电气石手册仅用于核对3m，不据照片确定电气石种属。"
    ]
  },
  "evidence": [
    {
      "type": "reference_model",
      "source": "既有十五组模型的参考参数；照片不随通用包分发",
      "status": "assumed"
    }
  ]
}